xml_num,organization,tax_year,form,address,city,website,ein,start_yr,mission,principal_officer,employee_count,volunteer_count,PY_total_revenue,PY_total_expenses,PY_net,CY_total_revenue,CY_total_expenses,CY_net,CY_total_EOY_assets,CY_total_EOY_liabilities,CY_fund_balance,CY_total_salaries,CY_grants_contributions,CY_program_service_rev
579,Northeast Addison Television Inc,2019,990EZ,25B Main Street,Bristol,www.neatbristol.com,010621878,NA,NA,NA,NA,NA,NA,NA,NA,NA,NA,NA,NA,NA,110999,NA,NA,NA
585,OLD DOG DOCUMENTARIES INC,2018,990EZ,16 CHURCH STREET,WOODSTOCK,WWW.OLDDOGDOCUMENTARIES.COM,261684638,NA,NA,NA,NA,NA,NA,NA,NA,NA,NA,NA,NA,NA,30512,NA,NA,NA
592,NA,NA,NA,NA,NA,NA,030212900,NA,NA,NA,NA,NA,NA,NA,NA,NA,NA,NA,NA,NA,NA,NA,NA,NA
593,RUTLAND REGION COMMUNITY TELEVISION,2019,990,1 SCALE AVE 108 BLDG 24,RUTLAND,WWW.PEGTV.COM,030343449,1993,TO SUPPORT AND PROMOTE PROGRAMS BY INDEPENDENT PRODUCERS IN THE RUTLAND REGION FOR EDUCATION GOVERNMENTAL AND PUBLIC ACCESS,NA,16,151,905762,820665,85097,913861,820665,138295,2783799,51085,2732714,474601,NA,882823
601,STARBASE VERMONT INCORPORATED,2018,990EZ,62 NCO DRIVE,SOUTH BURLINGTON,WWW.STARBASEVT.ORG,030357350,NA,NA,NA,NA,NA,NA,NA,NA,NA,NA,NA,NA,NA,61534,NA,NA,NA
604,THE FB STEARNS SUPPORTING ORGANIZATION,2018,990EZ,978 DURGIN HILL ROAD,VERSHIRE,N/A,347108261,NA,NA,NA,NA,NA,NA,NA,NA,NA,NA,NA,NA,NA,NA,NA,NA,NA
605,THE VALLEY PLAYERS INC,2018,990EZ,PO BOX 441,WAITSFIELD,WWW.VALLEYPLAYERS.COM,030278673,NA,NA,NA,NA,NA,NA,NA,NA,NA,NA,NA,NA,NA,96798,NA,NA,NA
614,Vermont Museum of Natural History Inc,2018,990EZ,7599 Vermont Route 9,West Marlboro,www.vermontmuseum.org,030353083,NA,NA,NA,NA,NA,NA,NA,NA,NA,NA,NA,NA,NA,325156,NA,NA,NA
616,Vermont Public Radio,2018,990,365 Troy Avenue,Colchester,VPR.NET,030259051,1975,"Listener-supported Vermont Public Radio has been serving the people of Vermont and the surrounding region since 1977. As Vermonts only statewide public radio network, VPR provides an essential and trusted independent voice for news, information, music and cultural exploration for the people of our region. Our purpose is to inspire an informed public and an engaged community.",NA,101,45,12116470,10086793,2029677,10881705,10086793,595439,30152050,447935,29704115,5185521,7119399,2538047
618,Vermont Stage Company,2018,990,110 Main Street,Burlington,www.vermontstage.org,030342411,1994,"To create theatre that makes our community a better place by producing plays that show us that what we have in common is more powerful than what separates us, providing a supportive professional environment in which theatre artists are inspired to perform their best work, enhancing the cultural and commercial vitality of our community, and encouraging the development of Vermont audiences and their love of theatre.",Cristina Alicea,NA,87,528931,494474,34457,521150,494474,23163,211436,67727,143709,106202,231422,274037
622,VERY MERRY THEATRE,2019,990,77 POMEROY STREET,BURLINGTON,WWW.VERYMERRYTHEATRE.ORG,043608726,2002,NA,DONALD WRIGHT,52,NA,257924,235551,22373,269623,235551,-48,38119,3097,35022,167829,56732,193169
626,Woodstock Community Trust Inc,2019,990,PO Box 802,Woodstock,www.woodstockcommunitytrust.com,030357761,1997,"The Woodstock Community Trust provides community-centered solutions for housing, commercial spaces, and preservation of agricultural land and natural areas while working toward a sustainable economic and enviromental future for Woodstock and it's citizens.",Maggie Fink,NA,NA,52700,19227,33473,520485,19227,474227,522620,14920,507700,NA,518385,2100
627,Yestermorrow Inc,2019,990,7865 Main Street,Waitsfield,www.yestermorrow.org,030278594,1980,"Yestermorrow Design/Build School inspires people to create a better, more sustainable world by providing hands-on education that integrates design and craft as a creative, interactive process.",John Connell,24,NA,1082281,1120576,-38295,1199752,1120576,85414,1410252,174837,1235415,653274,223826,902483
NA,NA,NA,NA,NA,NA,NA,NA,NA,NA,NA,NA,NA,NA,NA,NA,NA,NA,NA,NA,NA,NA,NA,NA,NA
