xml_num,organization,tax_year,form,address,city,website,ein,start_yr,mission,principal_officer,employee_count,volunteer_count,PY_total_revenue,PY_total_expenses,PY_net,CY_total_revenue,CY_total_expenses,CY_net,CY_total_EOY_assets,CY_total_EOY_liabilities,CY_fund_balance,CY_total_salaries,CY_grants_contributions,CY_program_service_rev
9,Clean Energy States Alliance Inc,2019,990,50 State Street,Montpelier,www.cesa.org,270029803,2002,"Technical support to States' clean energy agencies. CESA is a national nonprofit organization dedicated to advancing state and local efforts to implement smart clean energy policies, programs, technology innovation, and financing tools to drive increased investment and market making.",Anthony Vargo,NA,14,1565197,1395391,169806,1541453,1395391,-17351,1094126,269797,824329,838077,1251720,284379
13,ECOLOGIA INC,2018,990EZ,PO BOX 268,MIDDLEBURY,N/A,232604224,NA,NA,NA,NA,NA,NA,NA,NA,NA,NA,NA,NA,NA,15552,NA,NA,NA
15,The Equinox Preservation Trust Inc,2018,990PF,PO Box 46,Manchester,NA,043197313,NA,NA,NA,NA,NA,NA,NA,NA,NA,NA,NA,88639,1622,NA,NA,NA,NA
19,Foundation for a Sustainable Future,2018,990PF,410 Camels Hump Road,Huntington,NA,200028886,NA,NA,NA,NA,NA,NA,NA,NA,NA,NA,NA,13459438,NA,NA,NA,NA,NA
25,GUANACASTE DRY FOREST CONSERVATION FUND,2018,990,4780 MAIN ROAD,HUNTINGTON,www.gdfcf.org,943280315,1997,The mission of the GDFCF is to carry out any project or initiative that will increase the chances of survival of the ecosystems and biodiversity of Area de Conservacion Guanacaste in Northern Costa Rica. See Schedule O for additional details.,NA,NA,15,6007561,2166001,3841560,4011292,2166001,1794998,17111063,181243,16929820,760634,3534249,271040
36,LAKE SAINT CATHERINE ASSOCIATION INC,2019,990EZ,PO BOX 631,WELLS,N/A,030270055,NA,NA,NA,NA,NA,NA,NA,NA,NA,NA,NA,NA,NA,90650,NA,NA,NA
37,Lewis Creek Watershed Association,2019,990,PO Box 313,Charlotte,www.lewiscreek.org,030349148,1995,NA,Martha Illick,NA,74,156205,128464,27741,226889,128464,33768,95950,NA,NA,44213,224829,1556
38,LUCY MACKENZIE HUMANE SOCIETY INC,2018,990,PO BOX 702,Brownsville,NA,036006562,1915,PROVIDING SHELTER AND ADOPTION SERVICES FOR HOMELESS ANIMALS,SUSAN COPELAND,18,NA,458419,488587,-30168,393201,488587,-144257,3401790,7082,3394708,238038,224514,69841
41,New England Tropical Conservatory Inc,2018,990EZ,160 Benmont Ave Ste C3-80A,Bennington,NA,043140998,NA,NA,NA,NA,NA,NA,NA,NA,NA,NA,NA,NA,NA,391304,NA,NA,NA
49,REGULATORY ASSISTANCE PROJECT,2019,990,50 STATE STREET NO 3,MONTPELIER,WWW.RAPONLINE.ORG,010471151,1992,NA,NOELLE MACKAY,31,NA,7980411,7726366,254045,7861211,7726366,-748228,6736910,1725796,5011114,4465965,6888145,871478
50,NA,NA,NA,NA,NA,NA,760799202,NA,NA,NA,NA,NA,NA,NA,NA,NA,NA,NA,NA,NA,NA,NA,NA,NA
54,ROOTSWORK INC,2018,990EZ,PO BOX 31,WARREN,WWW.ROOTSWORK.ORG,043346507,NA,NA,NA,NA,NA,NA,NA,NA,NA,NA,NA,NA,NA,134030,NA,NA,NA
57,Stark Mountain Foundation Inc,2018,990,PO Box 1221,Waitsfield,www.starkmountain.org,030369897,2000,To preserve and protect the environment of Stark Mountain.,James Elkind,NA,NA,1105186,716549,388637,1844692,716549,1361346,2217519,NA,2217519,NA,1829075,NA
60,VERMONT FAMILY FORESTS FOUNDATION,2018,990,PO BOX 254,BRISTOL,WWW.FAMILYFORESTS.ORG,203294728,2016,SUSTAINABLE FORESTRY PRACTICES,JONATHAN CORCORAN,NA,NA,427649,308862,118787,369537,308862,25802,1418808,22502,1396306,147083,313693,48812
62,VERMONT INSTITUTE OF NATURAL SCIENCE,2018,990,149 NATURES WAY PO BOX 1281,QUECHEE,WWW.VINSWEB.ORG,030231665,1972,NA,CHARLES F RATTIGAN,47,180,2650011,1508847,1141164,2877776,1508847,1242657,7115371,678959,6436412,965182,1943839,719254
63,Vermont Natural Resources Council Inc,2018,990,9 Bailey Avenue,Montpelier,www.vnrc.org,030223731,1963,NA,Brian Shupe,19,16,3251721,1189074,2062647,1773969,1189074,494850,6184451,110826,6073625,848844,1617821,15519
67,Windsor Good News Electronics,2014,990,PO Box 723,Windsor,N/A,030488164,2002,Provide a mechanism to dispose of,JOANNE JACKSON,14,15,316463,405129,-88666,256967,405129,-71777,44084,30140,13944,163580,7345,289803
72,CENTRAL VERMONT HUMANE SOCIETY INC,2018,990,PO BOX 687,MONTPELIER,WWW.CentralvermontHUMANE.org,030217066,1964,TO EDUCATE THE PUBLIC IN THE PREVENTION OF CRUELTY TO ANIMALS AND PROVIDE SHELTER AND MEDICAL CARE FOR HOMELESS ANIMALS AS WELL AS ASSIST IN FINDING PERMANENT HOMES FOR THESE ANIMALS.,SHARON ASAY,21,83,847306,774808,72498,763704,774808,37417,1342374,196330,1146044,446110,421618,196671
76,Clean Energy Group Inc,2019,990,50 State Street,Montpelier,www.cleanegroup.org,030359346,1998,"Clean energy research and advocacy. Clean Energy Group promotes effective clean energy policies, develops low carbon technology innovation strategies and promotes new financial tools to strengthen the economy and stabilize climate change.",Anthony Vargo,16,NA,2741916,1835433,906483,1544822,1835433,-208082,2453831,389769,2064062,1101847,790345,738734
79,NA,NA,NA,NA,NA,NA,030363125,NA,NA,NA,NA,NA,NA,NA,NA,NA,NA,NA,NA,NA,NA,NA,NA,NA
83,Energy Action Network Inc,2017,990,17 State Street,Montpelier,N/A,455424161,2012,To enable systemic change to achieve Vermont's Energy and emission,JARED DUVAL,NA,NA,516985,382691,134294,487663,382691,119320,679197,10319,668878,227050,479952,7311
90,Friends of the Mad River,2019,990,PO Box 255,Waitsfield,friendsofthemadriver.org,030348974,1991,"To protect, improve, and enhance the ecological, recreational, and community values of the Mad River and its watershed. Strategies to achieve these goals include research, education, advocacy, and cooperative partnerships with neighbors, businesses, governments, and other organizations.",F Kincaid Perot,NA,75,205768,151000,54768,419454,151000,14930,370929,2247,368682,97063,409049,5355
91,FRIENDS OF THE WINOOSKI RIVER INC,2018,990EZ,PO BOX 777,MONTPELIER,www.winooskiriver.org,030368386,NA,NA,NA,NA,NA,NA,NA,NA,NA,NA,NA,NA,NA,66106,NA,NA,NA
96,Highland Cat Rescue Inc,2019,990EZ,59 Highland Circle,Springfield,NA,820986259,NA,NA,NA,NA,NA,NA,NA,NA,NA,NA,NA,NA,NA,NA,NA,NA,NA
101,THE JENCKES FOUNDATION INC,2018,990PF,2124 BUTTERFIELD ROAD MARLBORO,BRATTLEBORO,NA,030363194,NA,NA,NA,NA,NA,NA,NA,NA,NA,NA,NA,237824,NA,NA,NA,NA,NA
102,Kidsgardeningorg Inc,2019,990,132 Intervale Road,Burlington,www.kidsgardening.org,811103989,2016,"KidsGardening creates opportunities for kids to learn through the garden, engaging their natural curiousity and wonder by providing inspiration, community, know-how, and resources.",Emily Shipman,NA,NA,407613,424552,-16939,442868,424552,-33924,144179,235448,-91269,234094,220959,198908
103,KRATT BROTHERS CREATURE HERO SOCIETY,2018,990PF,PO BOX 475,STOWE,NA,043436143,NA,NA,NA,NA,NA,NA,NA,NA,NA,NA,NA,1229862,33823,NA,NA,NA,NA
113,NORTH COUNTRY ANIMAL LEAGUE INC,2019,990,16 MOUNTAIN VIEW MEADOW ROAD,MORRISVILLE,WWW.NCAL.COM,030344067,1994,ANIMAL HUMANE SHELTER AND PLACEMENT.,TRACY GOLDFINE,24,48,616605,646719,-30114,1114524,646719,437640,1439229,16322,1422907,448787,936980,141888
115,Parks For Paws Ltd,2019,990EZ,723 Carmel Place,Rutland,NA,814280912,NA,NA,NA,NA,NA,NA,NA,NA,NA,NA,NA,NA,NA,5850,NA,NA,NA
116,PEOPLE &amp; PLANTS INTERNATIONAL INC,2018,990EZ,PO BOX 251,BRISTOL,WWW.PEOPLEANDPLANTS.ORG,900147624,NA,NA,NA,NA,NA,NA,NA,NA,NA,NA,NA,NA,NA,922,NA,NA,NA
117,POPE MEMORIAL FRONTIER ANIMAL,2019,990,C/O B HAMPTON 502 STRAWBERRY ACRES,NEWPORT,WWW.FRONTIERANIMALSOCIETY.COM,030337856,1993,"PROVIDE HOUSING, CARE AND FEEDING OF STRAY AND UNWANTED CATS AND DOGS. PRIMARY OBJECTIVE IS TO CYCLE ANIMALS BACK INTO LOVING ADOPTIVE HOMES. SECONDARILY, PROVISION OF EDUCATION IN AN EFFORT TO ASSURE EVERY PET OWNER IS EDUCATED IN THE PROPER CARE AND MAINTENANCE OF ANIMALS.",BETSY HAMPTON,NA,NA,206566,290498,-83932,811327,290498,506338,3344492,11301,3333191,92781,165210,65034
119,POTTERS ANGELS RESCUE INC,2018,990EZ,3890 NORTH RANDOLPH ROAD,RANDOLPH CENTER,www.pottersangelsrescue.org,275459364,NA,NA,NA,NA,NA,NA,NA,NA,NA,NA,NA,NA,NA,187219,NA,NA,NA
123,RICHMOND LAND TRUST INC,2019,990,PO BOX 605,RICHMOND,WWW.RICHMONLANDTRUST.ORG,222859809,1987,"TO PRESERVE THE RURAL CHARACTER AND QUALITY OF LIFE IN RICHMOND, VERMONT AND ITS SURROUNDING COMMUNITIES THROUGH LAND CONSERVATION, HISTORIC PRESERVATION, LAND STEWARDSHIP, COMMUNITY SERVICE AND EDUCATION.",JEREMY HOFF,NA,20,76918,10198,66720,82505,10198,63078,654737,NA,654737,NA,81907,NA
128,South Hero Land Trust Inc,2019,990,PO Box 455,South Hero,www.shlt.org,043391477,1997,"Land conservation and environmental education. The South Hero Land Trust is dedicated to protecting farmland, woodland, natural and recreational areas and open spaces in South Hero, Vermont.",Emily Alger,NA,260,164260,176684,-12424,190181,176684,36615,1270730,18903,1251827,74001,142958,1555
129,ST ALBANS AREA WATERSHED ASSOC,2018,990EZ,PO BOX 1567,ST ALBANS,WWW.SAINTALBANSWATERSHED.ORG,412196343,NA,NA,NA,NA,NA,NA,NA,NA,NA,NA,NA,NA,NA,21900,NA,NA,NA
130,ST JOHNSBURY WORKS INC,2019,990EZ,51 DEPOT SQUARE SUITE 202,ST JOHNSBURY,WWW.DISCOVERSTJVT.COM,020674821,NA,NA,NA,NA,NA,NA,NA,NA,NA,NA,NA,NA,NA,62964,NA,NA,NA
132,Sustainable Woodstock Inc,2018,990,PO Box 611,Woodstock,www.sustainablewoodstock.org,271178081,2009,"Founded in 2009 the mission of the organization is to inspire, educate and empower everyone to live environmentally, economically and socially responsible lives.",Michael Caduto,NA,80,159902,136383,23519,312549,136383,119066,231075,1307,229768,68956,271229,36656
134,Noise Pollution Clearing House Inc,2018,990EZ,PO Box 1137,Montpelier,www.nonoise.org,311601550,NA,NA,NA,NA,NA,NA,NA,NA,NA,NA,NA,NA,NA,38066,NA,NA,NA
135,THE VERMONT CENTER FOR ECOSTUDIES INC,2019,990,PO BOX 420,NORWICH,VTECOSTUDIES.ORG,510639429,2007,NA,CHRISTOPHER C RIMMER,18,13700,1095048,1099219,-4171,1218845,1099219,-28071,902281,104469,NA,899131,1168603,37861
139,VERMONT ENERGY INVESTMENT CORPORATION,2018,990,128 LAKESIDE AVENUE NO 401,BURLINGTON,WWW.VEIC.ORG,030304418,1986,NA,SCOTT COMEAU,310,NA,95648100,92719368,2928732,87429577,92719368,2029166,22684853,9910542,NA,32757313,NA,87335778
141,VERMONT PAWS &amp; BOOTS INC,2019,990EZ,PO BOX 153,WILLISTON,N/A,814207432,NA,NA,NA,NA,NA,NA,NA,NA,NA,NA,NA,NA,NA,86132,NA,NA,NA
145,VERMONT VOLUNTEER SERVICES FOR ANIMALS,2015,990EZ,PO BOX 100,Bridgewater,NA,030318162,NA,NA,NA,NA,NA,NA,NA,NA,NA,NA,NA,NA,NA,78136,NA,NA,NA
147,White River Animal Rescue,2018,990,1196 Dothan Rd,White River Junction,www.whiteriveranimalrescue.org,263821674,NA,Finding homes for dogs in need,NA,NA,NA,108059,101409,6650,113554,101409,452,9160,NA,9160,NA,30544,83010
150,American Environmental Health Studies Project Inc,2019,990,16 Lamoille Street,Essex Junction,fluoridealert.org; americanhealthstudies.org,621599535,1994,"To facilitate projects that empower citizens and educate decision makers on issues that have the potential to harm human health or the environment, and offer alternative solutions which are environmentally just and sustainable.",Ellen Connett,NA,50,364057,327208,36849,404738,327208,-96075,288020,2004,286016,173198,404003,NA
158,Composting Association of Vermont,2018,990EZ,PO Box 643,Hinesburg,www.compostingvermont.org,743056927,NA,NA,NA,NA,NA,NA,NA,NA,NA,NA,NA,NA,NA,2219,NA,NA,NA
159,Connecticut Valley Fair Inc,2017,990EZ,PO Box 818,Bradford,www.bradfordfair.org,237168840,NA,NA,NA,NA,NA,NA,NA,NA,NA,NA,NA,NA,NA,208944,NA,NA,NA
162,EARTHWALK VERMONT INC,2018,990,PO BOX 21,PLAINFIELD,EARTHWALKVERMONT.ORG,113744202,2005,NATURE BASED EDUCATION.,ELAINE TOOHEY,25,19,461444,367060,94384,318168,367060,-56428,68763,32490,36273,273851,90495,223183
165,ENVIRONMENTAL SCIENCE POLICY AND,2018,990,PO BOX 250,ST ALBANS BAY,WWW.ESPRINSTITUTE.ORG,811347753,2016,"THE ENVIRONMENTAL SCIENCE, POLICY, AND RESEARCH INSTITUTE (ESPRI) FILLS KNOWLEDGE, DATA AND POLICY GAPS TO ADVANCE BASIC SCIENCE, PUBLIC HEALTH AND ENVIRONMENTAL STEWARDSHIP.",JENNIFER CLANCY,NA,NA,NA,NA,NA,500756,NA,62933,65046,500,64546,222661,NA,500756
174,North Branch Nature Center Inc,2019,990,713 Elm Street,Montpelier,www.northbranchnaturecenter.org,760830759,2006,Connect People of All Ages with the natural world,Chip Darmstadt,19,75,716632,663364,53268,794393,663364,39013,1261589,206825,1054764,481656,299421,488127
180,THE HOOVED ANIMAL SANCTUARY,2016,990EZ,PO BOX 258,CHELSEA,WWW.HOOVED.ORG,311816855,NA,NA,NA,NA,NA,NA,NA,NA,NA,NA,NA,NA,NA,29617,NA,NA,NA
181,HUBBARD BROOK RESEARCH FOUNDATION INC,2018,990,30 PLEASANT ST,WOODSTOCK,WWW.HUBBARDBROOKFOUNDATION.ORG,020474938,1995,NA,ANTHEA LAVALLEE,13,10,598569,581365,17204,697140,581365,44005,1730057,105560,1624497,411691,610621,50000
182,ISLE LA MOTTE PRESERVATION TRUST INC,2019,990,PO BOX 274,ISLE LAMOTTE,WWW.ILMPT.ORG,030359329,1998,NA,LINDA FITCH,NA,40,29497,18719,10778,42624,18719,23205,1305758,NA,1305758,NA,32923,4730
183,JERICHO UNDERHILL LAND TRUST INC,2019,990,PO BOX 80,JERICHO,WWW.JULT.ORG,030358707,1989,"CONSERVE OUR PRODUCTIVE WORKING LANDSCAPE, SCENIC VISTAS AND IMPORTANT WILDLIFE HABITATS BY WORKING HAND-IN-HAND WITH LANDOWNERS AND INTERESTED CITIZENS WHO SHARE A SIMILAR GOAL.",OLIVIA STRONG,NA,10,29028,13545,15483,77726,13545,60768,1219923,NA,1219923,NA,76937,360
186,LAKE CHAMPLAIN COMMITTEE INC,2018,990,208 FLYNN AVENUEBUILDING 3SUITE F,BURLINGTON,WWW.LAKECHAMPLAINCOMMITTEE.ORG,222482466,1963,"LCC IS DEDICATED TO PROTECTING LAKE CHAMPLAIN'S ENVIRONMENTAL INTEGRITY AND RECREATIONAL RESOURCES FOR THIS AND FUTURE GENERATIONS THROUGH SCIENCE- BASED ADVOCACY, EDUCATION, AND COLLABORATIVE ACTION.",LORI FISHER,NA,230,425351,237341,188010,318143,237341,48105,1227920,66250,1161670,171094,296454,NA
189,LAKE RESCUE ASSOCIATION,2017,990EZ,PO BOX 372,LUDLOW,www.lakerescue.org,030368496,NA,NA,NA,NA,NA,NA,NA,NA,NA,NA,NA,NA,NA,139131,NA,NA,NA
193,National Gardening Association Inc,2015,990,237 Commerce St Suite 101,Williston,"www.garden.org, www.kidsgardening.org",237346417,1973,"To promote home, school and community gardening as a means to renew and sustain connections between people, plants and the environment.",Jennifer Tedeschi,15,NA,362853,416234,-53381,672191,416234,-247158,189694,589503,-399809,580401,40602,528821
194,NEW LEARNING JOURNEY INC,2018,990EZ,700 BRAGG HILL ROAD,FAYSTON,N/A,474879926,NA,NA,NA,NA,NA,NA,NA,NA,NA,NA,NA,NA,NA,102290,NA,NA,NA
196,NORTHEAST RECYCLING COUNCIL INC,2019,990,139 MAIN STREET NO 401,BRATTLEBORO,WWW.NERC.ORG,030367144,2000,NA,KALEY LALEKER,NA,11,919752,788417,131335,714490,788417,16484,1073369,2367,NA,289525,439364,266873
197,NORTHEAST WILDERNESS TRUST CORPORATION,2019,990,17 STATE STREET NO 302,MONTPELIER,WWW.NEWILDERNESSTRUST.ORG,010729039,2002,NA,JON LEIBOWITZ,NA,NA,2519568,551142,1968426,3571751,551142,2898955,14967848,333098,14634750,375835,3451331,66015
202,PROJECT PEARL,2018,990EZ,P O BOX 25044,WINSTON SALEM,WWW.PROJECTPEARLNC.ORG,454357090,NA,NA,NA,NA,NA,NA,NA,NA,NA,NA,NA,NA,NA,55065,NA,NA,NA
205,RECYCLEBALLS,2019,990,102 KIMBALL AVENUE UNIT 1,SOUTH BURLINGTON,WWW.RECYCLEBALLS.ORG,814157244,2016,RECYCLING OF USED TENNIS BALLS,DERRICK SENIOR,NA,NA,176512,111822,64690,338266,111822,8915,253361,177821,75540,52139,134110,58638
207,The Dorset Equine Rescue Inc,2019,990,PO Box 92,East Dorset,NA,463192988,2013,"To rescue, rehabilitate, and re-home abused, neglected and slaughter bound horses of all breads and sizes. To provide a safe, loving and rehabilitative home, including all needed medical care, to every incoming animal. Once ready for their forever family, each horse is placed in a prescreened and qualified home. To educate the community about all matters of horse care, health and advocacy to continously improve the long-honored and time-tested human equine partnership.",NA,NA,NA,201526,163146,38380,230395,163146,25737,118834,9084,109750,74534,230366,NA
210,VERMONT COVERTSWOODLANDS FOR,2018,990,PO BOX 328,VERGENNES,WWW.VTCOVERTS.ORG,030332447,1985,TO ENLIST VERMONT LANDOWNERS IN A LONG-TERM COMMITMENT TO MAINTAIN AND ENHANCE DIVERSE WILDLIFE HABITAT AND HEALTHY ECOSYSTEMS.,LISA SAUSVILLE,NA,NA,201544,78824,122720,72210,78824,-12894,253054,5844,247210,47203,74987,10278
211,VERMONT ENGLISH BULLDOG RESCUE INC,2018,990PF,PO BOX 5264,ESSEX JUNCTION,NA,473445350,NA,NA,NA,NA,NA,NA,NA,NA,NA,NA,NA,11102,NA,NA,NA,NA,NA
217,NA,2018,NA,NA,Hinesburg,www.vtdogrescue.com,NA,NA,NA,NA,NA,NA,NA,NA,NA,NA,NA,NA,NA,NA,20523,NA,NA,NA
219,NA,NA,NA,NA,NA,NA,030349262,NA,NA,NA,NA,NA,NA,NA,NA,NA,NA,NA,NA,NA,NA,NA,NA,NA
220,WINDHAM COUNTY HUMANE SOCIETY,2019,990,PO BOX 397,BRATTLEBORO,windhamcountyhumane.org,036016140,1905,"The Windham County Humane Society is dedicated to ensuring the safety and well being of animals, as well as enhancing the relationship between individuals and pets through adoption, education, advocacy, compassion and promotion of animal welfare.",Julie Hamilton,17,NA,1047064,601393,445671,798039,601393,191356,2157902,25604,2132298,331234,514853,169940
223,Addison County Humane Society Inc,2019,990,236 Boardman Street,Middlebury,www.homewardboundanimals.org,030264068,1975,NA,Jessica Danyow,32,80,670849,695464,-24615,911164,695464,109657,2226139,11899,NA,499922,742017,115181
225,ALLIANCE FOR VERMONT COMMUNITIES INC,2019,990,PO BOX 545,SOUTH ROYALTON,ALLIANCEVERMONT.ORG,813430662,2016,NA,MICHAEL SACCA,NA,24,341382,72886,268496,83194,72886,45511,453824,87000,NA,NA,83194,NA
226,ALMOST HOME DOG RESCUE AND REHAB INC,2017,990PF,1067 JUNCTION ROAD,MONTPELIER,NA,455434057,NA,NA,NA,NA,NA,NA,NA,NA,NA,NA,NA,1348,NA,NA,NA,NA,NA
227,KAUFMAN BARBARA CHARITABLE TRUST LMHS,2019,990,PO BOX 120,NEWPORT,N/A,046878510,1998,To Support the efforts and goals of the LMHS.,NA,NA,NA,28146,48880,-20734,48706,48880,207,653960,NA,653960,6324,NA,NA
229,NA,2013,990,NA,NA,NA,030369585,2001,"ACHIEVE A HEALTHIER ENVIRONMENT, STRENGTHEN LOCAL ECONOMIES, AND INCREASE ENERGY SECURITY ACROSS THE UNITED STATES THROUGH THE DEVELOPMENT OF SUSTAINABLE BIOMASS ENERGY SYSTEMS AT THE COMMUNITY SCALE. BIOMASS ENERGY RESOURCE CENTER PROVIDES INDEPENDENT AND UNBIASED RESEARCH, TECHNICAL ASSISTANCE FOR COMMUNITY-SCALE PROJECT AND PROGRAM DESIGN AND IMPLEMENTATION AND THROUGH PUBLIC EDUCATION.",BRENDA QUIROZ MADAY,NA,NA,526460,662475,-136015,26851,662475,-34376,NA,NA,NA,15746,NA,27740
231,CENTER FOR AMERICAS FIRST HORSE,2019,990,PO BOX 31,JOHNSON,NA,272411065,2011,"YEAR ROUND NATURAL HORSEMANSHIP EDUCATION, TRAINING, BOARDING, LESSONS, NATURAL HORSEMANSHIP FOR CHILDREN PROGRAMS, SUMMER SESSIONS, ON AND OFF SITE NATURAL HORSEMANSHIP CLINICS, EDUCATIONSL TOURS, VOLUNTEER.",NA,NA,NA,79853,85640,-5787,65466,85640,9941,190812,157344,33468,9125,34170,31296
232,Center For Sustainable Organizations Inc,2019,990EZ,PO Box 705,Woodstock,www.sustainableorganizations.org,202020870,NA,NA,NA,NA,NA,NA,NA,NA,NA,NA,NA,NA,NA,17926,NA,NA,NA
233,CENTER FOR WHOLE COMMUNITIES INC,2018,990,PO BOX 5483,BURLINGTON,www.wholecommunities.org,510462232,2003,Center for Whole Communities exists to cultivate transformative leadership that weaves together and strengthens movements for justice and the environment.,VIRGINIA MCGINN,NA,NA,581486,601232,-19746,736574,601232,60600,269512,15444,254068,316897,299697,433903
234,Champlain Valley Pug Rescue,2015,990EZ,993 Hinesburg Road,Charlotte,N/A,261862470,NA,NA,NA,NA,NA,NA,NA,NA,NA,NA,NA,NA,NA,5602,NA,NA,NA
239,Eddy Farm School For Horse and Rider Corporation,2019,990,1815 South Street Extension,Middlebury,www.eddyfarmschool.com,030360517,1998,The Eddy Farm School For Horse &amp; Rider Corporation's Mission is to teach traditional horsemanship skills and promote amateur athletic competition,Abigail Schnoor,NA,50,126191,116905,9286,128206,116905,-8350,701342,NA,701342,NA,8486,108391
243,THE FEDERATION FUND FOR CONSERVATION AND TRAINING,2019,990,14 STAFFORD AVE,MORRISVILLE,N/A,030358290,1997,"THE ORGANIZATION TEACHES THE GENERL PUBLIC, CONSERVATION, OUTDOOR SURVIVAL, AND PROPER HANDLING OF FIREARMS",ROY MARBLE,NA,NA,52167,20454,31713,37418,20454,26929,400564,NA,400564,NA,4225,NA
245,FOUR WINDS NATURE INSTITUTE INC,2019,990,4 CASEY RD,CHITTENDEN,WWW.FOURWINDSINSTITUTE.ORG,205139630,2006,"Four Winds Nature Institute, Inc. advances the understanding, appreciation and protection of the environment through community-based natural science education and research. Four Winds staff members are educators and scientists dedicated to helping children and adults gain the background knowledge and science skills needed to understand the world around them and the problem-solving and citizenship skills needed to protect it. In choosing and developing programs, Four Winds is committed to those that address the following goals: (1) programs that increase people's knowledge of the natural world through direct observation, hands-on learning activities, and rich outdoor experiences; (2) programs that improve science literacy (content and skills) by encouraging people to explore their local environment; (3) programs that connect a broad and diverse audience of people to the natural world on an ongoing and meaningful basis; and (4) programs that provide people with the critical thinking, pro",Lisa Purcell,11,1241,279283,303394,-24111,297121,303394,14967,225796,74056,151740,213896,115466,180801
250,Gerdas Equine Rescue Inc,2018,990,P O Box 1352,West Townshend,www.gerdasequinerescue.org,593800477,2005,"Conduct programs that (1) rescue and rehabilitate animals (primarily horses), (2) promote and facilitate animal adoption and (3) operate a facility where the program mission is accomplished.",Gerda Silver,NA,18,196278,195947,331,236998,195947,-21124,44489,12952,31537,15512,182724,54274
251,Green Mountain Conservancy Incorporated,2016,990EZ,35 Frost Street,Brattleboro,www.greenmountainconservancy.org,270296118,NA,NA,NA,NA,NA,NA,NA,NA,NA,NA,NA,NA,NA,306549,NA,NA,NA
252,GREEN MOUNTAIN PUG RESCUE,2018,990,283 TOWN LINE RD,Mendon,N/A,460475635,NA,TO PROVIDE CARE AND HOME PLACEMENT TO THE ABANDONED AND ABUSED BREED OF PUGS,KELLI MAZZELLA,NA,NA,69781,72132,-2351,76281,72132,589,40705,NA,40705,NA,57725,18550
253,NA,2018,NA,NA,Greensboro,www.GreensboroAssociation.org,NA,NA,NA,NA,NA,NA,NA,NA,NA,NA,NA,NA,NA,NA,252852,NA,NA,NA
256,HYPERBARIC VERMONT INC,2019,990,1808 BRIDGMAN HILL ROAD,HARDWICK,www.hyperbaricvermont.org,300964512,2017,OUR MISSION IS TO MAKE HYPERBARIC OXYGEN THERAPY ACCESSIBLE AND AFFORDABLE FOR THOSE WHO CAN BENEFIT FROM IT.,NA,12,NA,195911,193004,2907,216114,193004,24715,97159,38461,58698,103693,91984,120360
257,NA,NA,NA,NA,NA,NA,030280149,NA,NA,NA,NA,NA,NA,NA,NA,NA,NA,NA,NA,NA,NA,NA,NA,NA
258,IRIS CORNELIA LOVE CHARITABLE TRUST,2018,990PF,352 POST ROAD HILL,LINCOLN,NA,043368971,NA,NA,NA,NA,NA,NA,NA,NA,NA,NA,NA,NA,NA,NA,NA,NA,NA
261,LAKE DUNMORE FERN LAKE ASSOCIATION,2019,990,PO BOX 14,SALISBURY,WWW.LDFLA.COM,030334363,1994,"TO PROTECT THE ECOLOGY, VITALITY OF DUNMORE &amp; FERN LAKES",JAY MICHAEL,17,20,341260,213332,127928,269931,213332,17278,2064754,1645,2063109,135265,173731,NA
265,METTA EARTH INSTITUTE INC,2018,990EZ,334 GEARY ROAD SOUTH,LINCOLN,METTAEARTH.ORG,270695274,NA,NA,NA,NA,NA,NA,NA,NA,NA,NA,NA,NA,NA,216988,NA,NA,NA
266,Jamie Montague,2018,NA,Po Box 804,Middlebury,N/A,NA,1987,"Promoting conservation, recreation, and education to the Middlebury Area.",NA,NA,185,136832,132897,3935,172380,132897,21493,1288325,1791,1286534,65249,81173,82703
267,NA,NA,NA,NA,NA,NA,043359920,NA,NA,NA,NA,NA,NA,NA,NA,NA,NA,NA,NA,NA,NA,NA,NA,NA
268,MOUNTAIN VIEW FARM ANIMAL SANCTUARY INC,2019,990EZ,PO BOX 38,EAST BURKE,N/A,870714335,NA,NA,NA,NA,NA,NA,NA,NA,NA,NA,NA,NA,NA,2355,NA,NA,NA
271,NINEVAH FOUNDATION,2019,990,401 FARM AND WILDERNESS ROAD,PLYMOUTH,WWW.NINEVAHFOUNDATION.ORG,043283140,1995,"LAND AND LAKE CONSERVATION, STEWARDSHIP, AND EDUCATION",FRANCES MCLAUGHLIN,NA,20,276401,133889,142512,122047,133889,-47521,3065418,77370,2988048,NA,48367,39842
273,NA,NA,NA,NA,NA,NA,510196388,NA,NA,NA,NA,NA,NA,NA,NA,NA,NA,NA,NA,NA,NA,NA,NA,NA
275,PASSUMPSIC VALLEY LAND TRUST,2014,990,PO BOX 624,SAINT JOHNSBURY,WWW.PVLT.ORG,030340587,1993,"OUR MISSION IS TO PROTECT WATER QUALITY, ECOLOGICAL INTEGRITY, WILDLIFE HABITAT AND RECREATIONAL ACCESS BY ACQUIRING AND MANAGING FEE LANDS AND CONSERVATION EASEMENTS",LEONARD GERARDI,NA,NA,156316,41751,114565,104707,41751,47475,499272,NA,499272,NA,103501,NA
277,PUTNEY MOUNTAIN ASSOCIATION,2019,990,POB 953,PUTNEY,WWW.PUTNEYMOUNTAIN.ORG,030316666,NA,THE PUTNEY MOUNTAIN ASSOCIATION BELIEVES THERE IS A VITAL LINK BETWEEN HUMAN BEINGS AND THE NATURAL ENVIRONMENT. OUR PRIMARY OBJECTIVES ARE TO STRENGTHEN THAT LINK BY PRESERVING UNDEVELOPED LAND ON WINDMILL RIDGE IN SOUTHEASTERN VERMONT FOR THE BENEFIT AND ENJOYMENT OF PRESENT AND FUTURE GENERATIONS AND TO PROTECT THE NATURAL HABITAT AND WILDLIFE CORRIDOR OF THE AREA.,PAT SHIELDS,NA,NA,162534,35394,127140,104976,35394,91201,1167900,NA,1167900,NA,74491,NA
281,RIVERSIDE RESCUE INC,2019,990EZ,236 RIVERSIDE AVENUE,LUNENBURG,WWW.RIVERSIDEANIMALRESCUE.ORG,202184387,NA,NA,NA,NA,NA,NA,NA,NA,NA,NA,NA,NA,NA,39938,NA,NA,NA
282,RUTLAND COUNTY HUMANE SOCIETY INC,2019,990,765 STEVENS ROAD,PITTSFORD,WWW.RCHSVT.ORG,036006930,NA,PROVIDE SHELTER AND CARE FOR UP TO 120 HOMELESS ANIMALS AND TO MATCH ANIMALS IN OUR CARE WITH ADOPTIVE FAMILIES. TO SPAY AND NEUTER LOOSE ANIMALS IN OUR COMMUNITIES THAT ARE BEING CARED FOR BY MEMBERS OF OUR COMMUNITY. TO EDUCATE PET OWNERS ABOUT SAPYING AND NEUTERING THEIR HOUSEHOLD PETS.,BETH SARADARIAN,27,175,528917,584835,-55918,639016,584835,65099,1772534,12172,1760362,353814,474208,113823
285,SANDBHREAGH WILDLANDS SANCTUARY &amp; TRUST,2017,990PF,105 TAYLOR VALLEY ROAD,VERSHIRE,NA,367632470,NA,NA,NA,NA,NA,NA,NA,NA,NA,NA,NA,NA,NA,NA,NA,NA,NA
287,NA,2013,990EZ,NA,NA,N/A,260455905,NA,NA,NA,NA,NA,NA,NA,NA,NA,NA,NA,NA,NA,69081,NA,NA,NA
290,NA,NA,NA,NA,NA,NA,542196266,NA,NA,NA,NA,NA,NA,NA,NA,NA,NA,NA,NA,NA,NA,NA,NA,NA
291,SPRINGFIELD HUMANE SOCIETY INC,2019,990,401 SKITCHEWAUG TRAIL,SPRINGFIELD,www.spfldhumane.org,237032106,1956,PREVENTION OF CRUELTY TO ANIMALS,DEB NORTON,NA,125,283503,277894,5609,294698,277894,-22290,980377,NA,980377,151506,134859,112337
